{
  "id": "dayu",
  "title": "大禹治水",
  "subtitle": "从洪水之世，到九州既定",
  "author": "中华历史故事",
  "duration": "约 12 分钟",
  "cover": "./assets/story/01-flood.webp",
  "source": "据《史记·夏本纪》《尚书·禹贡》等整理改写",
  "sourceNote": "神话、灾害记忆与历史叙事在此交织",
  "modes": {
    "explain": {
      "label": "简明讲解",
      "shortLabel": "讲解",
      "icon": "message-circle",
      "description": "先说清发生了什么，适合快速理解。"
    },
    "story": {
      "label": "沉浸故事",
      "shortLabel": "故事",
      "icon": "sparkles",
      "description": "跟随人物与现场，像听一段历史故事。"
    },
    "source": {
      "label": "史料导读",
      "shortLabel": "史料",
      "icon": "book-open",
      "description": "分清古书记载、传说与后世解释。"
    }
  },
  "chapters": [
    {
      "id": "flood",
      "number": "第一章",
      "numeral": "壹",
      "title": "洪水之世",
      "image": "./assets/story/01-flood.webp",
      "summary": "大水抹去熟悉的边界，也迫使人们共同寻找生路。",
      "takeaway": "灾难首先改变的，是人与土地原有的关系。",
      "segments": [
        {
          "id": "flood-arrives",
          "eyebrow": "洪水初至",
          "title": "洪水横流",
          "alt": "洪水淹没群山之间的村落，大禹站在高处凝望灾情",
          "summary": "大水越过河岸，田野、道路和居所渐渐失去边界。",
          "modes": {
            "explain": {
              "text": "传说尧舜之时，洪水横流，浩浩荡荡地包围山陵。河道容不下连日而来的大水，浑浊的水面越过堤岸，田野、道路与屋舍渐渐失去边界。对先民而言，熟悉的土地忽然变成了一片无法辨认的汪洋。",
              "audio": "./assets/audio/flood-arrives.mp3"
            },
            "story": {
              "text": "雨像从天上倾倒下来，一夜又一夜没有停。清晨，人们推开门，昨日的田埂已经沉入浑水；再过半日，通往邻村的路也消失了。站在山坡回望，屋顶在水面上若隐若现，熟悉的家园仿佛被重新画成了一片陌生的汪洋。",
              "audio": "./assets/audio/flood-arrives-story.mp3"
            },
            "source": {
              "text": "《尚书·尧典》用“汤汤洪水方割，荡荡怀山襄陵”形容洪水包围山陵；《史记·夏本纪》沿用了这一记忆。这并非现代意义的现场记录，却保留了早期人群对大范围水患的共同叙述，也是大禹故事展开的起点。",
              "audio": "./assets/audio/flood-arrives-source.mp3"
            }
          }
        },
        {
          "id": "flood-refuge",
          "eyebrow": "迁往高处",
          "title": "高地求生",
          "alt": "人们带着牲畜与物资沿山路迁往高地",
          "summary": "人们携老扶幼迁往山坡，在高地等待水势退去。",
          "modes": {
            "explain": {
              "text": "低处无法停留，人们带着粮食、器具和牲畜，沿着山路迁往高处。有人寻找可以暂住的坡地，有人守望水势，也有人重新辨认被洪流切断的道路。洪水不仅带走收成，也把共同生存变成必须一起回答的难题。",
              "audio": "./assets/audio/flood-refuge.mp3"
            },
            "story": {
              "text": "老人被扶上木车，孩子抱紧仅剩的粮袋，牛羊在泥水里不安地叫。队伍沿着山路一点点向高处移动。没有人知道水何时退去，只能分出人手搭棚、生火、看守山口。到了夜里，坡地上的微光连成一线，那是他们暂时守住的生活。",
              "audio": "./assets/audio/flood-refuge-story.mp3"
            },
            "source": {
              "text": "先秦文献更关心治水者与政治秩序，很少细写普通人的迁徙。高地避水的场景，是依据早期聚落面对洪水的一般生存经验所作的谨慎还原。阅读时应把它视为历史情境重建，而非某一古书逐字记载。",
              "audio": "./assets/audio/flood-refuge-source.mp3"
            }
          }
        }
      ]
    },
    {
      "id": "blocked",
      "number": "第二章",
      "numeral": "贰",
      "title": "治水之争",
      "image": "./assets/story/02-blocked.webp",
      "summary": "围堵带来短暂安全，也让积水在堤后聚成更大的力量。",
      "takeaway": "办法是否有效，要看它能否顺应系统，而不只看眼前。",
      "segments": [
        {
          "id": "blocked-dikes",
          "eyebrow": "筑土为障",
          "title": "鲧筑堤防",
          "alt": "众人用石土修筑堤坝，试图阻挡奔涌的洪水",
          "summary": "鲧带领众人不断加高堤障，希望把洪水围在河道之内。",
          "modes": {
            "explain": {
              "text": "尧命鲧治理洪水。鲧选择筑堤围堵：以土石加高岸线，把奔涌的水挡在居所之外。堤障一层层增高，短时间里似乎护住了一些土地，人们因此继续加固，希望用更高、更厚的壁垒压住水势。",
              "audio": "./assets/audio/blocked-dikes.mp3"
            },
            "story": {
              "text": "人们把泥土装进筐里，一趟趟运到河岸。堤障升高后，村落终于有了几天安稳，孩子重新跑到屋外。可堤外的水仍在上涨，日夜拍打新筑的土墙。鲧站在堤顶，只能命人继续加高，因为身后已经没有可以后退的地方。",
              "audio": "./assets/audio/blocked-dikes-story.mp3"
            },
            "source": {
              "text": "《史记》记鲧治水“九年而水不息”，后世常把他的办法概括为围堵。古书并未留下完整工程图景，“筑堤”是对传统叙事的归纳。鲧的失败也承担了叙事功能：为禹的不同方法建立对照。",
              "audio": "./assets/audio/blocked-dikes-source.mp3"
            }
          }
        },
        {
          "id": "blocked-fails",
          "eyebrow": "旧法已穷",
          "title": "围堵未平",
          "alt": "石土堤坝被洪水冲开，众人在激流两侧抢险",
          "summary": "越积越高的水终究冲破堤坝，旧办法走到了尽头。",
          "modes": {
            "explain": {
              "text": "然而水势被层层拦住，反而越积越高。堤坝一旦崩裂，洪流便带着更大的力量冲向下游。九年过去，灾情仍未平息。失败留下了一个清楚的教训：只和水争高低，并不能真正为它安排去处。",
              "audio": "./assets/audio/blocked-fails.mp3"
            },
            "story": {
              "text": "裂缝最初只有手指宽，泥水从缝里细细渗出。人们抬来石块堵住它，脚下却忽然一震。堤坝像被推开的门一样崩裂，积蓄已久的洪水冲向下游。喊声被水声吞没，那一刻大家明白，再高的墙也不能让无处可去的水消失。",
              "audio": "./assets/audio/blocked-fails-story.mp3"
            },
            "source": {
              "text": "鲧是否真的只用“堵”，学界无法从传世文献中复原。传统文本强调“水不息”和治水失败，后世由此形成“鲧堵禹疏”的鲜明对照。这个对照适合解释故事结构，却不应被当作已证实的工程史结论。",
              "audio": "./assets/audio/blocked-fails-source.mp3"
            }
          }
        }
      ]
    },
    {
      "id": "channel",
      "number": "第三章",
      "numeral": "叁",
      "title": "疏川导水",
      "image": "./assets/story/03-channel.webp",
      "summary": "先辨认山川高下，再为水打开可以抵达大海的道路。",
      "takeaway": "理解规律，往往比单纯增加力量更重要。",
      "segments": [
        {
          "id": "channel-survey",
          "eyebrow": "跋涉山川",
          "title": "遍察高下",
          "alt": "大禹沿山川跋涉，观察水流与地势的高下",
          "summary": "禹没有急着筑起新堤，而是先辨认山川与水的方向。",
          "modes": {
            "explain": {
              "text": "禹接过使命后，没有照搬旧法。他先跋涉山川，辨认土地高下，观察水从哪里汇聚，又被什么阻住。传说他常年在外，三次经过家门也没有进去。故事把艰苦的勘察，凝结成后来反复讲述的责任象征。",
              "audio": "./assets/audio/channel-survey.mp3"
            },
            "story": {
              "text": "禹把脚伸进湍流，感受水推向哪一边；又登上山脊，把河谷的走向记在心里。冬去春来，他的鞋底磨穿了一双又一双。三次路过家门时，屋里传来熟悉的声音，他停了一下，最终仍沿河道向远方走去。",
              "audio": "./assets/audio/channel-survey-story.mp3"
            },
            "source": {
              "text": "《史记》写禹“陆行乘车，水行乘船，泥行乘橇，山行乘檋”，突出广泛踏勘；“三过家门而不入”则成为后世最熟悉的责任叙事。具体次数与细节属于传说层，但长期协作与地理观察是文本反复强调的核心。",
              "audio": "./assets/audio/channel-survey-source.mp3"
            }
          }
        },
        {
          "id": "channel-open",
          "eyebrow": "因势利导",
          "title": "疏川决壅",
          "alt": "大禹与众人凿开山谷，水流沿新河道奔向远方",
          "summary": "众人打开壅塞、连接河道，让水沿地势奔向大海。",
          "modes": {
            "explain": {
              "text": "禹带领众人疏通河道、决开壅塞，使支流汇入大川，再由大川奔向大海。古书把这种方法概括为“疏川导滞”。水仍然奔流，却开始沿着土地能够承受的道路前行。治理不再只是阻挡，而是理解水势并为它找到出口。",
              "audio": "./assets/audio/channel-open.mp3"
            },
            "story": {
              "text": "石锤落下，山口传来沉闷的回声。众人清走最后一层壅塞，水先是一线，随后汇成奔涌的河流，沿新开的通道向低处远去。岸边的人没有欢呼，只静静看着水位一点点下降——他们第一次看见，洪水也可以有方向。",
              "audio": "./assets/audio/channel-open-story.mp3"
            },
            "source": {
              "text": "《尚书·禹贡》以山川、贡赋与区域秩序描述治水后的天下；《史记》则写禹“通九道，陂九泽，度九山”。这些宏大数字带有象征意味。所谓“疏导”，更适合视为后世从多种文本中提炼的治理理念。",
              "audio": "./assets/audio/channel-open-source.mp3"
            }
          }
        }
      ]
    },
    {
      "id": "settled",
      "number": "第四章",
      "numeral": "肆",
      "title": "九州既定",
      "image": "./assets/story/04-settled.webp",
      "summary": "河流归道，聚落与田野在新的水土秩序中恢复。",
      "takeaway": "好的治理不是消灭自然，而是建立可以共存的秩序。",
      "segments": [
        {
          "id": "settled-fields",
          "eyebrow": "河流归道",
          "title": "水土既平",
          "alt": "河流穿过恢复耕作的田野与村落，人们在晨光中劳作",
          "summary": "低地重新露出，人们沿着安定的河流恢复耕作与居住。",
          "modes": {
            "explain": {
              "text": "当河流有了去处，水势逐渐平缓，低地重新露出。人们修整道路、重建屋舍，在河流两岸恢复耕作。水没有从生活里消失，而是以灌溉、运输和时令的方式重新进入日常。治水的结果，是人与水之间建立了新的秩序。",
              "audio": "./assets/audio/settled-fields.mp3"
            },
            "story": {
              "text": "最先露出水面的是一截旧田埂。人们踩着湿软的土地返回低处，扶起倒塌的木架，重新挖出灶坑。春风吹过河岸时，新苗终于连成一片。河水仍在身旁流淌，却不再是吞没一切的黑色浪头，而成了田野可以依靠的水脉。",
              "audio": "./assets/audio/settled-fields-story.mp3"
            },
            "source": {
              "text": "古书将治水成功与田土、道路、贡赋和区域秩序联系在一起，反映的是理想政治图景。我们无法据此确定某一年真实完成了全国性工程，但文本清楚表达了一个观念：水土治理与社会重建不可分开。",
              "audio": "./assets/audio/settled-fields-source.mp3"
            }
          }
        },
        {
          "id": "settled-memory",
          "eyebrow": "后世相传",
          "title": "留下记忆",
          "alt": "晨光照亮恢复秩序的河谷，大禹沿河岸走向远方",
          "summary": "大禹治水成为关于协作、责任和理解自然的共同记忆。",
          "modes": {
            "explain": {
              "text": "大禹治水并非一段可以被完全考证的实录，它交织着古代文献、灾害记忆与后世传说。但这个故事长久流传，是因为它保存了先民理解自然、组织协作的经验：面对巨大的力量，人可以选择对抗，也可以观察规律，与众人一起改变道路。",
              "audio": "./assets/audio/settled-memory.mp3"
            },
            "story": {
              "text": "许多年后，曾经逃往高地的孩子已经老去。他指着安静的河道，对下一代讲起那场几乎淹没天地的洪水，也讲起无数人如何丈量山川、搬走泥石、打开水路。名字在传说里汇成“大禹”，而共同改变家园的记忆，被一代代留了下来。",
              "audio": "./assets/audio/settled-memory-story.mp3"
            },
            "source": {
              "text": "关于禹，考古、古文字与传世文献仍存在许多未决问题。因此更稳妥的读法，是把大禹治水看作复合记忆：它可能包含真实水患经验，也经过政治理想与道德叙事的长期塑形。确定与不确定，都是理解这段传统的一部分。",
              "audio": "./assets/audio/settled-memory-source.mp3"
            }
          }
        }
      ]
    }
  ],
  "version": "1.0"
}
