{
  "id": "silk-road",
  "title": "丝路西行",
  "subtitle": "张骞凿空，从长安走向万里之外",
  "author": "汉代历史故事",
  "duration": "约 10 分钟",
  "cover": "./assets/story/05-silk-departure.webp",
  "source": "据《史记·大宛列传》《汉书·张骞李广利传》等整理改写",
  "sourceNote": "行程与人物以传世文献为线索，现场细节属于克制的历史情境重建",
  "modes": {
    "explain": {
      "label": "简明讲解",
      "shortLabel": "讲解",
      "icon": "message-circle",
      "description": "先说清发生了什么，适合快速理解。"
    },
    "story": {
      "label": "沉浸故事",
      "shortLabel": "故事",
      "icon": "sparkles",
      "description": "跟随人物与现场，像听一段历史故事。"
    },
    "source": {
      "label": "史料导读",
      "shortLabel": "史料",
      "icon": "book-open",
      "description": "分清古书记载、传说与后世解释。"
    }
  },
  "chapters": [
    {
      "id": "mission",
      "number": "第一章",
      "numeral": "壹",
      "title": "长安辞行",
      "image": "./assets/story/05-silk-departure.webp",
      "summary": "一份寻找盟友的使命，把汉朝使者送向尚未被中原清楚认识的西方。",
      "takeaway": "远行最初并不是为了浪漫的探索，而是对现实困局的回应。",
      "segments": [
        {
          "id": "silk-call",
          "eyebrow": "建元募使",
          "title": "寻找月氏",
          "alt": "汉代使者在长安城门外整装，远处道路通向西方群山",
          "summary": "汉武帝听说月氏被匈奴驱逐，招募能够越过河西寻找他们的使者。",
          "modes": {
            "explain": {
              "text": "汉武帝从降人处得知，月氏被匈奴击败后向西迁徙，仍有复仇之意。汉朝希望与月氏联手牵制匈奴，于是公开招募出使者。郎官张骞应募。这次远行的目标不是开辟商路，而是在几乎没有可靠地图的情况下，寻找一个远方盟友。",
              "audio": "./assets/audio/silk-call.mp3"
            },
            "story": {
              "text": "诏令传到郎官之间时，许多人都沉默了。向西的道路要先穿过匈奴控制的地带，月氏究竟迁到哪里，也没有人能说清。张骞走上前去领命。他接过符节，知道这并不是一次有归期的差遣，而是向地图空白处迈出的第一步。",
              "audio": "./assets/audio/silk-call-story.mp3"
            },
            "source": {
              "text": "《史记·大宛列传》记载，汉武帝得知月氏西迁并想报复匈奴，于是招募能够出使的人，张骞以郎官身份应募。后世常把这次出发视为丝路开端，但当时最直接的目标，是寻求军事联盟。",
              "audio": "./assets/audio/silk-call-source.mp3"
            }
          }
        },
        {
          "id": "silk-depart",
          "eyebrow": "持节西出",
          "title": "告别长安",
          "alt": "张骞与随员牵着驮马离开长安城门，向辽阔西方出发",
          "summary": "张骞与堂邑氏胡奴甘父从陇西出发，踏入漫长而未知的旅途。",
          "modes": {
            "explain": {
              "text": "约在公元前一三八年，张骞带着汉朝符节和随员从陇西出发。同行者中有熟悉北方道路、后来与他一同归来的甘父。队伍携带的物资有限，而前方的距离、语言和政治边界都不清楚。所谓出使，首先是一场高风险的地理穿越。",
              "audio": "./assets/audio/silk-depart.mp3"
            },
            "story": {
              "text": "城门在晨光里缓缓打开。张骞回头看了一眼长安，随后把符节收好，带着队伍向西。田地渐少，风里的沙尘渐多，熟悉的地名一个个留在身后。没有路标告诉他们还要走多远，只有落日每天沉向同一个方向。",
              "audio": "./assets/audio/silk-depart-story.mp3"
            },
            "source": {
              "text": "传世文献对出发仪式没有细写，但明确提到张骞与堂邑氏胡奴甘父等从陇西出发。故事中的城门、行装与告别属于情境重建；年代通常据后世编年推定为汉武帝建元年间。",
              "audio": "./assets/audio/silk-depart-source.mp3"
            }
          }
        }
      ]
    },
    {
      "id": "farlands",
      "number": "第二章",
      "numeral": "贰",
      "title": "绝域十年",
      "image": "./assets/story/06-silk-crossing.webp",
      "summary": "被扣留、逃脱、翻越山岭，最初的使命在十余年里不断改变。",
      "takeaway": "真正改变认知的，往往不是按计划抵达，而是在偏离计划后仍继续观察。",
      "segments": [
        {
          "id": "silk-captive",
          "eyebrow": "中途被留",
          "title": "十年羁留",
          "alt": "张骞在风雪山道上带领小队继续西行",
          "summary": "使团很快被匈奴截获，张骞被扣留多年，却一直没有放弃原来的使命。",
          "modes": {
            "explain": {
              "text": "使团进入匈奴势力范围后被截获。张骞在那里被留十余年，也建立了家庭。长期羁留并没有让他的使命消失；他仍保存着汉朝使者的身份，等待能够继续西行的机会。后来他带着少数随员逃脱，再次向月氏所在方向前进。",
              "audio": "./assets/audio/silk-captive.mp3"
            },
            "story": {
              "text": "一年又一年，草原的冬雪落下又融化。张骞学会在当地生活，也有了牵挂，但那枚符节所代表的使命始终没有离开。他没有把等待当作停滞，而是记住道路、语言和各方消息。机会出现时，他与少数同伴离开营地，重新把方向指向西方。",
              "audio": "./assets/audio/silk-captive-story.mp3"
            },
            "source": {
              "text": "《史记》称张骞被匈奴留置十余岁，并为他娶妻、生子；之后他得以逃脱。符节是否始终随身，文献叙述带有强调忠诚的意味。可以确认的是，长期羁留成为整个行程中最重要的转折。",
              "audio": "./assets/audio/silk-captive-source.mp3"
            }
          }
        },
        {
          "id": "silk-yuezhi",
          "eyebrow": "越过葱岭",
          "title": "终于见到月氏",
          "alt": "汉代使团越过雪山与峡谷，驮马沿险路前行",
          "summary": "张骞经大宛、康居抵达大月氏，却发现对方已经安居，不愿东返复仇。",
          "modes": {
            "explain": {
              "text": "张骞向西经过大宛与康居，终于抵达大月氏。可是月氏已经占据肥沃土地，生活安定，对重返东方、攻击匈奴并不热心。张骞停留观察，最终没能达成结盟目标。出使在外交上失败了，却让汉朝第一次获得一组较系统的西方见闻。",
              "audio": "./assets/audio/silk-yuezhi.mp3"
            },
            "story": {
              "text": "翻过雪山之后，眼前出现了不同的城郭、田地与集市。张骞终于见到寻找多年的月氏人，却发现他们已经在新的河谷安顿下来。旧日仇恨没有消失，却不足以让整个族群再次远征。那晚，张骞明白使命可能无法完成，于是开始更仔细地记录眼前世界。",
              "audio": "./assets/audio/silk-yuezhi-story.mp3"
            },
            "source": {
              "text": "《史记》叙述张骞经大宛、康居抵达大月氏；月氏因新居土地肥饶而无意报复匈奴。具体路线与地名对应仍有讨论，文本最重要的变化，是使者从寻求联盟转向收集广泛见闻。",
              "audio": "./assets/audio/silk-yuezhi-source.mp3"
            }
          }
        }
      ]
    },
    {
      "id": "opening",
      "number": "第三章",
      "numeral": "叁",
      "title": "凿空之后",
      "image": "./assets/story/07-silk-return.webp",
      "summary": "两人从百余人的队伍中归来，带回的不是传奇宝物，而是一幅更大的世界图景。",
      "takeaway": "道路的意义，不只在第一次抵达，还在后来有更多人能够往返。",
      "segments": [
        {
          "id": "silk-return",
          "eyebrow": "十三年后",
          "title": "两人归来",
          "alt": "风尘仆仆的汉代使者在殿中展开路线图向众人讲述西域",
          "summary": "归途中再次被扣留后，张骞与甘父终于返回长安，出发时的百余人只剩两人。",
          "modes": {
            "explain": {
              "text": "张骞返程时试图避开原路，却再次被匈奴扣留。后来趁内部变故逃出，约十三年后回到汉朝。出发时的一百多人，归来时只剩张骞和甘父。张骞把大宛、大夏、康居等地的见闻报告朝廷，使遥远地名第一次连成可以讨论的区域。",
              "audio": "./assets/audio/silk-return.mp3"
            },
            "story": {
              "text": "长安城门再次出现在视野里时，两个人几乎认不出自己离开时的道路。张骞衣衫破旧，甘父也已满面风霜。他们没有带回想象中的盟军，只带回一路记住的山川、城郭、物产与人群。十三年的空白，从他们的讲述中一点点变成了地图。",
              "audio": "./assets/audio/silk-return-story.mp3"
            },
            "source": {
              "text": "《史记》记张骞归来时同行者仅余他与堂邑父两人。十三年是依据出发与归来年代的概括。今天常见的精确路线图多为后世复原，张骞真正带回的更可能是口述、见闻与方向关系。",
              "audio": "./assets/audio/silk-return-source.mp3"
            }
          }
        },
        {
          "id": "silk-open",
          "eyebrow": "使者相望",
          "title": "道路被看见",
          "alt": "汉代官员与使者围绕地图交谈，殿外新的队伍沿道路出发",
          "summary": "后来的使者沿着张骞带回的信息继续出发，跨区域往来逐渐变得频繁。",
          "modes": {
            "explain": {
              "text": "张骞之后，汉朝继续派遣使者前往乌孙及其他地区。人员、马匹、物产和知识沿多条道路流动，后来被统称为丝绸之路。它并不是张骞一人铺成的单一路线，而是许多既有地方道路被持续连接、维护和重新理解的结果。",
              "audio": "./assets/audio/silk-open.mp3"
            },
            "story": {
              "text": "新的队伍在城外集结，行囊里有礼物，也有写满问题的木简。张骞指着曾经走过的方向，告诉他们哪里有水，哪里要翻山，哪里需要不同的语言。道路仍旧漫长危险，但它不再完全未知。一次孤独的远行，开始变成许多人可以接续的往返。",
              "audio": "./assets/audio/silk-open-story.mp3"
            },
            "source": {
              "text": "《史记》用“凿空”形容张骞之后使者往来获得了可信基础。“丝绸之路”则是近代形成的概括名称。使用这个名称时，应理解它包含多条陆海线路、许多中间社会和长期累积的交流，而非一条由单个人突然开通的道路。",
              "audio": "./assets/audio/silk-open-source.mp3"
            }
          }
        }
      ]
    }
  ],
  "version": "1.0"
}
